,Comp,File,Line,Spkr,StTime,Content,EnTime,inv
234.1614,DCB,DCB_se3_ag3_f_02_1,2285,DCB_se3_ag3_f_02,2316.8197,"So he would try everything, I mean, you could just be like, flat like a pancake and he would try",2321.1973,1
234.462,DCB,DCB_se3_ag3_f_02_1,2315,DCB_se3_ag3_f_02,2350.9304,"And he would just be so upset, but he knew that it was-",2353.07,1
278.625,DCB,DCB_se3_ag3_f_02_1,2532,DCB_se3_ag3_f_02,2563.387,"/What I'm'a do/ Simple City, Simple City and Eastgate beef, but I be around both areas (laughing)",2566.8236,1
92.1916,DCB,DCB_se3_ag3_m_01_1,934,DCB_se3_ag3_m_01,890.617,"species number three. It be me little ST, the baddest one of them all, finna make them snakes fall. (rapping)",895.6156,1
385.102,DCB,DCB_se3_ag3_m_02_1,1521,DCB_se3_ag3_m_02,1817.2948,"I mean, call my mother and be like, w- what you doing Saturday, and we're like, nothing.",1819.8581,1
397.26,DCB,DCB_se3_ag3_m_02_1,1590,DCB_se3_ag3_m_02,1893.9338,"Sister be like, why?",1894.7213,1
607.21,DCB,DCB_se3_ag3_m_02_1,3034,DCB_se3_ag3_m_02,3669.1236,people from- it ain't gonna just be people from Benning Road that go over there to see that band play.,3672.3435,1
148.557,DCB,DCB_se3_ag4_f_01_1,1065,DCB_se3_ag4_f_01,1159.7962,prostitution- U Street started to get- be known for,1162.6919,1
270.142,DCB,DCB_se3_ag4_f_01_1,2082,DCB_se3_ag4_f_01,2160.3402,You know- We'd hang out and be stupid at the library.,2162.2613,1
422.194,DCB,DCB_se3_ag4_f_01_1,4200,DCB_se3_ag4_f_01,4171.1952,"you know, have me be down there. And if I didn't have transportation to a f- I just-",4174.5432,1
267.41,DCB,DCB_se3_ag4_f_02_1,2285,DCB_se3_ag4_f_02,2465.1028,it's in proximity to Georgetown. But I never considered it be Georgetown because they call it Foggy Bottom,2470.3967,1
