,Comp,File,Line,Spkr,StTime,Content,EnTime,inv
48.3,DCA,DCA_se1_ag1_f_01_1,183,DCA_se1_ag1_f_01,197.8384,some- some children be on one team,199.9916,1
48.5,DCA,DCA_se1_ag1_f_01_1,185,DCA_se1_ag1_f_01,200.3086,and some be on another-,201.5536,1
128.3,DCA,DCA_se1_ag1_f_01_1,439,DCA_se1_ag1_f_01,502.6921,"every time you be bad, she'll holler at you.",505.2089,1
288.1,DCA,DCA_se1_ag1_f_01_1,843,DCA_se1_ag1_f_01,1044.8825,"Sometime I be with uh,",1046.4259,1
10.328,DCA,DCA_se1_ag1_f_02_1,29,DCA_se1_ag1_f_02,29.3533,Sometime I just be at home.,30.7662,1
20.3,DCA,DCA_se1_ag1_f_02_1,73,DCA_se1_ag1_f_02,68.249,"Two people be at each end, /carrying/ a rope like this.",70.7389,1
48.31,DCA,DCA_se1_ag1_f_02_1,213,DCA_se1_ag1_f_02,224.4868,a girl be standing way far from away from me. And- and two people- a lot of people be standing back.,229.3863,1
144.7,DCA,DCA_se1_ag1_f_02_1,650,DCA_se1_ag1_f_02,671.0269,"The Monday night, Tuesday night [movies.] /Like if/ anything be on good.",674.4914,1
328.6,DCA,DCA_se1_ag1_f_02_1,1229,DCA_se1_ag1_f_02,1333.1858,and told him that they be writing back to him.,1335.2235,1
461.2,DCA,DCA_se1_ag1_f_02_1,1708,DCA_int_04,1890.3185,Can anybody just be in that group or-,1892.3515,1
498.3,DCA,DCA_se1_ag1_f_02_1,1838,DCA_se1_ag1_f_02,2066.2856,I be over with my friends.,2067.7264,1
20.51,DCA,DCA_se1_ag1_f_03_1,47,DCA_se1_ag1_f_03,71.8093,that- that person be what he was at first.,74.5045,1
24.51,DCA,DCA_se1_ag1_f_03_1,60,DCA_se1_ag1_f_03,85.4274,"and if the last person that don't say, not it, that's the one that be it.",88.9281,1
34.4,DCA,DCA_se1_ag1_f_03_1,81,DCA_se1_ag1_f_03,119.5622,"/at um,/ the last person that I said a word on, that's the one be it.",122.691,1
76.211,DCA,DCA_se1_ag1_f_03_1,204,DCA_se1_ag1_f_03,300.1917,"If I be doing something, they don't like it. Like if I talk a lot or chew gum or something, they'll holler at me and like, if I [fuss back] at them,",306.7513,1
30.71,DCA,DCA_se1_ag1_f_04_1,164,DCA_se1_ag1_f_04,162.2188,well they be throwing it to the su- su- a sugar ball and if you be k- caught,165.7491,1
30.91,DCA,DCA_se1_ag1_f_04_1,166,DCA_se1_ag1_f_04,166.489,they be throwing you to the trash can.,168.1687,1
42.111,DCA,DCA_se1_ag1_f_04_1,263,DCA_se1_ag1_f_04,265.2618,"and somebody be up,",266.8215,1
42.151,DCA,DCA_se1_ag1_f_04_1,267,DCA_se1_ag1_f_04,268.6711,and we be down at the next corner.,270.5708,1
64.33,DCA,DCA_se1_ag1_f_04_1,418,DCA_se1_ag1_f_04,420.4221,And the person who get the last one be first.,422.6877,1
88,DCA,DCA_se1_ag1_f_04_1,538,DCA_se1_ag1_f_04,586.2135,"No I don't watch 'em, I be outside.",588.1982,1
104.25,DCA,DCA_se1_ag1_f_04_1,608,DCA_se1_ag1_f_04,656.1916,"he be having um,",657.2764,1
1541,DCA,DCA_se1_ag1_f_04_1,802,DCA_se1_ag1_f_04,868.0615,Cause we be mean to her.,869.4563,1
298.11,DCA,DCA_se1_ag1_f_04_1,1312,DCA_se1_ag1_f_04,1503.3207,"Like if she be talking to somebody else, and always butting in.",1507.0738,1
304.11,DCA,DCA_se1_ag1_f_04_1,1351,DCA_se1_ag1_f_04,1546.3773,"And the teacher be in the hall,",1547.8048,1
306.21,DCA,DCA_se1_ag1_f_04_1,1360,DCA_se1_ag1_f_04,1553.5845,"it be on a record player,",1554.7168,1
448.11,DCA,DCA_se1_ag1_f_04_1,1821,DCA_se1_ag1_f_04,2096.5909,I don't want be no teacher.,2098.1309,1
544.5,DCA,DCA_se1_ag1_f_04_1,2120,DCA_se1_ag1_f_04,2477.2428,"in the street or the sidewalk or something, when you be skating.",2480.1973,1
6.511,DCA,DCA_se1_ag1_f_05_1,24,DCA_se1_ag1_f_05,27.6083,"on- You know, it be blocks in the street,",29.7206,1
16.71,DCA,DCA_se1_ag1_f_05_1,55,DCA_se1_ag1_f_05,61.9357,you be out.,62.6664,1
54.71,DCA,DCA_se1_ag1_f_05_1,219,DCA_se1_ag1_f_05,253.945,til you miss- They be counting [numbers.],256.6172,1
212.112,DCA,DCA_se1_ag1_f_05_1,707,DCA_se1_ag1_f_05,895.9744,"Cause sometime I be sleeping, and-",898.1689,1
266.41,DCA,DCA_se1_ag1_f_05_1,815,DCA_se1_ag1_f_05,1062.0781,I be so tired.,1063.2751,1
416.11,DCA,DCA_se1_ag1_f_05_1,1190,DCA_se1_ag1_f_05,1546.0853,They be working some,1547.7774,1
4181,DCA,DCA_se1_ag1_f_05_1,1194,DCA_se1_ag1_f_05,1550.1508,They be working.,1551.3085,1
4.341,DCA,DCA_se1_ag1_m_01_1,28,DCA_se1_ag1_m_01,25.6734,"one person be it,",26.8625,1
22.71,DCA,DCA_se1_ag1_m_01_1,100,DCA_se1_ag1_m_01,110.9546,"and whoever be the last one,",112.5446,1
855,DCA,DCA_se1_ag1_m_01_1,336,DCA_int_02,385.0206,What they be doing?,385.8646,1
12.313,DCA,DCA_se1_ag1_m_02_1,65,DCA_se1_ag1_m_02,77.5567,Uh-huh. And they be it.,78.4519,1
22.214,DCA,DCA_se1_ag1_m_02_1,110,DCA_se1_ag1_m_02,122.9846,"if he be king, you got to give it ten dollars. One, two, three, four, five, six, seven, eight, nine, ten.",128.2934,1
32.213,DCA,DCA_se1_ag1_m_02_1,174,DCA_se1_ag1_m_02,188.499,the last one be it.,189.4688,1
36.115,DCA,DCA_se1_ag1_m_02_1,186,DCA_se1_ag1_m_02,198.769,"And last one be it,",199.7855,1
76.178,DCA,DCA_se1_ag1_m_02_1,356,DCA_se1_ag1_m_02,368.987,"He- You know, like, it be about",370.6858,1
116.711,DCA,DCA_se1_ag1_m_02_1,909,DCA_se1_ag1_m_02,871.086,Like it be a /lean pursuit/,872.4383,1
122.21,DCA,DCA_se1_ag1_m_02_1,981,DCA_se1_ag1_m_02,923.9902,You know how it be some louder woods and things?,926.0326,1
204.6,DCA,DCA_se1_ag1_m_02_1,1712,DCA_se1_ag1_m_02,1578.6439,"If it be raining, she let us play games in there.",1581.339,1
12.511,DCA,DCA_se1_ag1_m_02_2,33,DCA_se1_ag1_m_02,41.8843,if it be her birthday coming up,43.5396,1
46.113,DCA,DCA_se1_ag1_m_03_1,298,DCA_se1_ag1_m_03,318.9984,[Like if] both of my hands be back there,320.9209,1
60.57,DCA,DCA_se1_ag1_m_03_1,520,DCA_se1_ag1_m_03,559.8801,because there's a lot of boys be on the porches.,562.6732,1
60.65,DCA,DCA_se1_ag1_m_03_1,528,DCA_se1_ag1_m_03,572.8406,"Then you call it cause most of them, they be trying to-",575.1534,1
60.67,DCA,DCA_se1_ag1_m_03_1,530,DCA_se1_ag1_m_03,575.4752,"my brothers, they be trying to sneak all the way around,",578.3557,1
78.515,DCA,DCA_se1_ag1_m_03_1,662,DCA_se1_ag1_m_03,710.4956,but I be out working.,711.7592,1
102.231,DCA,DCA_se1_ag1_m_03_1,827,DCA_se1_ag1_m_03,881.4519,Or he be replacing it.,883.162,1
102.31,DCA,DCA_se1_ag1_m_03_1,835,DCA_se1_ag1_m_03,892.5053,Then so they be going to airport. Then he tells-,894.705,1
108.309,DCA,DCA_se1_ag1_m_03_1,1293,DCA_se1_ag1_m_03,1313.1721,He be going /Jack/.,1314.1921,1
170.114,DCA,DCA_se1_ag1_m_04_1,375,DCA_se1_ag1_m_04,543.1701,"See sometime, the children, th- they be bothering you while you try and do your work.",546.6066,1
172.314,DCA,DCA_se1_ag1_m_04_1,383,DCA_se1_ag1_m_04,555.0209,They keep talking and sometime when they be talking I might talk back to 'em.,558.4155,1
172.513,DCA,DCA_se1_ag1_m_04_1,385,DCA_se1_ag1_m_04,558.764,"Sometime I don't. I be doing my work, and she'll think it's me.",561.5245,1
194.33,DCA,DCA_se1_ag1_m_04_1,445,DCA_se1_ag1_m_04,650.0463,"Miss /RD-NAME-3/, before we getting ready to go- she- she be sha-",653.2777,1
304.311,DCA,DCA_se1_ag1_m_04_1,746,DCA_se1_ag1_m_04,1108.5316,"I- By the time I get- be finished tryna spend it all, I probably be gone by now.",1112.48,1
356.11,DCA,DCA_se1_ag1_m_04_1,873,DCA_se1_ag1_m_04,1303.9484,to a trip. You got be dressed up. I think it's a restaurant.,1306.942,1
416.111,DCA,DCA_se1_ag1_m_04_1,1020,DCA_se1_ag1_m_04,1505.1098,"Yes, they always be fights.",1506.4761,1
456.5,DCA,DCA_se1_ag1_m_04_1,1155,DCA_se1_ag1_m_04,1704.7184,"gangs be fighting, they always say",1706.3224,1
456.9,DCA,DCA_se1_ag1_m_04_1,1159,DCA_se1_ag1_m_04,1708.5268,you be fighting somebody else.,1709.8604,1
20.514,DCA,DCA_se1_ag1_m_05_1,74,DCA_se1_ag1_m_05,107.2974,"the other um children, they be behind, she be in front of 'em.",110.654,1
156.138,DCA,DCA_se1_ag1_m_05_1,405,DCA_se1_ag1_m_05,596.5636,"they- and a man, the small man, who be a chef who know Karate,",601.0014,1
168.1101,DCA,DCA_se1_ag1_m_05_1,448,DCA_se1_ag1_m_05,674.7835,"Sometimes he be on the movies,",676.4795,1
387.32,DCA,DCA_se1_ag1_m_05_1,1108,DCA_int_07,1743.0284,"someone's gonna fight, you know, be in a fight or something. You thought you were going to get hurt?",1745.8613,1
207.34,DCA,DCA_se1_ag1_m_07_1,699,DCA_se1_ag1_m_07,966.9346,"Except for, you know, little things, like, be coming through the line,",969.904,1
215.111,DCA,DCA_se1_ag1_m_07_1,725,DCA_se1_ag1_m_07,1008.2552,"Well you know, you call that your walk man, you know, like the person that you be with all the time.",1012.9036,1
4.347,DCA,DCA_se1_ag1_m_07_2,16,DCA_se1_ag1_m_07,24.7084,"[northwest], and you know, be young ladies there.",27.3978,1
152.315,DCA,DCA_se1_ag1_m_08_1,711,DCA_se1_ag1_m_08,862.3823,"When I be playing football out the Club, I have a",864.5133,1
1604,DCA,DCA_se1_ag1_m_08_1,752,DCA_se1_ag1_m_08,911.7113,He could just be hisself as long as he not a square.,914.2712,1
216.143,DCA,DCA_se1_ag1_m_08_1,910,DCA_se1_ag1_m_08,1128.6765,"But uh, it be out",1129.6883,1
240.311,DCA,DCA_se1_ag1_m_08_1,996,DCA_se1_ag1_m_08,1253.2916,"you know, when I be talking to the fellas, you know, I might",1255.5345,1
228.312,DCA,DCA_se1_ag2_m_01_1,976,DCA_se1_ag2_m_01,1285.1026,"Well, it- it be mixed up all kinds a way- everybody just-",1288.534,1
228.512,DCA,DCA_se1_ag2_m_01_1,978,DCA_se1_ag2_m_01,1288.7014,just be there having a good time. That's-,1290.3792,1
268.2,DCA,DCA_se1_ag2_m_01_1,1092,DCA_se1_ag2_m_01,1452.7769,people be all the way from Baltimore here.,1454.6447,1
168.1103,DCA,DCA_se1_ag3_f_02_1,850,DCA_se1_ag3_f_02,1306.3542,Well usually there would always be two or three that were trouble makers.,1309.9566,1
268.19,DCA,DCA_se1_ag3_m_01_1,1797,DCA_se1_ag3_m_01,1973.2611,"just be together all the time. I don't know where, what it was.",1976.2887,1
56.416,DCA,DCA_se1_ag4_m_02_1,147,DCA_se1_ag4_m_02,164.4888,"[all], like three be buddies.",166.1355,1
464.71,DCA,DCA_se1_ag4_m_02_1,1482,DCA_se1_ag4_m_02,1819.0714,"<hums> you might think I'm crazy in there, you know, cause I be humming to myself.",1823.8202,1
24.128,DCA,DCA_se2_ag1_f_01_1,98,DCA_se2_ag1_f_01,107.6818,"Like when somebody's mother sick we be on the front porch,",110.4364,1
103.31,DCA,DCA_se2_ag1_f_01_1,827,DCA_int_01,815.7012,How about when you be in school?,817.0616,1
149.218,DCA,DCA_se2_ag1_f_01_1,996,DCA_int_01,1013.7886,"Think if a teacher be nice to the kids, that the kids will-",1016.3112,1
41.514,DCA,DCA_se2_ag1_f_02_1,483,DCA_se2_ag1_f_02,464.4595,"And she was nice, and- and- and if you be nice to her and do good work, and go home and study instead of going outside- running outside,",469.8953,1
271.9,DCA,DCA_se2_ag1_f_02_1,1565,DCA_se2_ag1_f_02,1566.0431,I mean I be nervous- I be a nervous wreck!,1567.9957,1
32.123,DCA,DCA_se2_ag1_f_03_1,75,DCA_se2_ag1_f_03,97.3072,It be two captains,98.7379,1
34.359,DCA,DCA_se2_ag1_f_03_1,89,DCA_se2_ag1_f_03,110.9075,The big children let the smaller children be the captain.,113.4567,1
38.125,DCA,DCA_se2_ag1_f_03_1,103,DCA_se2_ag1_f_03,127.0746,"See, it be /some/ um-",128.5833,1
58.143,DCA,DCA_se2_ag1_f_03_1,172,DCA_se2_ag1_f_03,208.1933,"It be two teams,",209.3458,1
58.32,DCA,DCA_se2_ag1_f_03_1,174,DCA_se2_ag1_f_03,209.5699,and there be a net.,210.5072,1
164.318,DCA,DCA_se2_ag1_f_03_1,614,DCA_se2_ag1_f_03,702.5426,come back in and then you know it be all happy and stuff.,705.3662,1
35111,DCA,DCA_se2_ag1_f_03_1,1644,DCA_se2_ag1_f_03,1686.8415,Cause in the day I be over to church.,1688.7092,1
379.7,DCA,DCA_se2_ag1_f_03_1,1761,DCA_se2_ag1_f_03,1815.4596,"You know she be the um,",1816.5617,1
30.99,DCA,DCA_se2_ag1_f_04_1,132,DCA_se2_ag1_f_04,184.6308,"um- Like one person be polar bear,",187.2318,1
4.355,DCA,DCA_se2_ag1_f_05_1,24,DCA_se2_ag1_f_05,23.7379,"Um, one person be it,",25.3921,1
80.817,DCA,DCA_se2_ag1_f_05_1,376,DCA_se2_ag1_f_05,449.1514,and be playing around,450.0794,1
80.227,DCA,DCA_se2_ag1_f_05_1,390,DCA_se2_ag1_f_05,467.1102,"Or if the boys be out, then we be talking to them.",469.4229,1
132.192,DCA,DCA_se2_ag1_f_05_1,569,DCA_se2_ag1_f_05,700.6875,"And she get mad cause if it be a lot of children in the hall, she ask us do we know 'em?",704.3426,1
140.1154,DCA,DCA_se2_ag1_f_05_1,603,DCA_se2_ag1_f_05,741.2484,"Well I usually be with /RD-NAME-2/,",743.1278,1
144.516,DCA,DCA_se2_ag1_f_05_1,619,DCA_se2_ag1_f_05,760.1099,"/RD-NAME-2/ upstairs, and um, the little one upstairs. She be with us all the time.",764.3994,1
20213,DCA,DCA_se2_ag1_f_05_1,744,DCA_se2_ag1_f_05,957.8559,Mm-mm. <laugh> The children be screaming and hollering.,960.4242,1
251.43,DCA,DCA_se2_ag1_f_07_1,836,DCA_se2_ag1_f_07,1045.0963,"Oh, kids are so rowdy, you know. She be trying to- She has a little soft voice- She be trying to keep 'em quiet. She-",1050.9191,1
25310,DCA,DCA_se2_ag1_f_07_1,840,DCA_se2_ag1_f_07,1052.9288,"And they just be hollering- She be hollering over there, and they be hollering over her.",1056.5752,1
311.35,DCA,DCA_se2_ag1_f_07_1,998,DCA_se2_ag1_f_07,1303.3108,Not in the [group] I be in. [No.],1305.01,1
325.4,DCA,DCA_se2_ag1_f_07_1,1031,DCA_se2_ag1_f_07,1351.9869,"my associates that I be with, they don't live on my street.",1354.78,1
26.13,DCA,DCA_se2_ag1_m_01_1,93,DCA_se2_ag1_m_01,98.8517,Or you be playing three.,99.9055,1
324.37,DCA,DCA_se2_ag1_m_01_1,1535,DCA_se2_ag1_m_01,1631.3832,with- That be my mother and grandmother and sister and brothers.,1633.8686,1
338.131,DCA,DCA_se2_ag1_m_01_1,1609,DCA_se2_ag1_m_01,1711.5188,"Probably be the best dressed man, you know, in the-",1713.6868,1
107.313,DCA,DCA_se2_ag1_m_02_1,670,DCA_int_01,759.4864,How would they be hard on you?,760.85,1
24.228,DCA,DCA_se2_ag1_m_03_1,62,DCA_se2_ag1_m_03,67.9862,"Well it's a guy be in the center of you,",69.9586,1
24.413,DCA,DCA_se2_ag1_m_03_1,64,DCA_se2_ag1_m_03,70.559,and you be in the- in the rear of the center.,72.2423,1
24.86,DCA,DCA_se2_ag1_m_03_1,68,DCA_se2_ag1_m_03,75.6602,There be about,76.1964,1
32.102,DCA,DCA_se2_ag1_m_03_1,101,DCA_se2_ag1_m_03,107.8226,And you be running up as fast as you can to get,109.6924,1
34.1121,DCA,DCA_se2_ag1_m_03_1,113,DCA_se2_ag1_m_03,123.9586,"Well, it be about five people,",125.6175,1
78.1116,DCA,DCA_se2_ag1_m_03_1,247,DCA_se2_ag1_m_03,267.1706,all the marbles be in the center.,268.5228,1
330.155,DCA,DCA_se2_ag1_m_03_1,1273,DCA_se2_ag1_m_03,1384.3389,"Christmas? Everybody be happy and celebrate,",1386.7636,1
148.223,DCA,DCA_se2_ag1_m_04_1,663,DCA_se2_ag1_m_04,614.5325,"Like I be playing,",615.6656,1
194.313,DCA,DCA_se2_ag1_m_04_1,928,DCA_se2_ag1_m_04,894.1323,and hang with the boys that be with us.,895.8357,1
20611,DCA,DCA_se2_ag1_m_04_1,971,DCA_se2_ag1_m_04,942.6545,I probably be a mail carrier.,944.0394,1
213.37,DCA,DCA_se2_ag1_m_04_1,994,DCA_int_02,971.5447,How about this summer? What do you- What will you be doing this summer? Will you be working then? You're in twelvth grade? Is that [right?],976.7008,1
219.319,DCA,DCA_se2_ag1_m_05_1,878,DCA_se2_ag1_m_05,1014.0604,everybody would b- be running around the block and,1016.5348,1
366.151,DCA,DCA_se2_ag1_m_05_1,1347,DCA_se2_ag1_m_05,1616.9684,be in a daze or b- be day dreaming,1618.929,1
418.111,DCA,DCA_se2_ag1_m_05_1,1573,DCA_se2_ag1_m_05,1898.5245,Yeah that's right it helps you /??/ and I used to always be swinging I used to give uh,1902.4255,1
445.73,DCA,DCA_se2_ag1_m_05_1,1663,DCA_se2_ag1_m_05,2010.4241,drastic kid I used to always be into something.,2012.6546,1
124.134,DCA,DCA_se2_ag2_m_01_1,395,DCA_se2_ag2_m_01,411.7154,"of uh, The Good, Bad and Ugly, it was- be bad. But the character they had in there, I guess he was- It was a new- tryna put a new character in it.",417.4598,1
286.64,DCA,DCA_se2_ag2_m_01_1,1002,DCA_se2_ag2_m_01,1142.8587,"nobody else would have none, so what it be worth- you know.",1144.7378,1
390.411,DCA,DCA_se2_ag2_m_02_1,1087,DCA_se2_ag2_m_02,1257.529,and it be boring as I don't know what.,1258.6854,1
668.11,DCA,DCA_se2_ag2_m_02_1,2098,DCA_se2_ag2_m_02,2468.9707,"how happy they be when I do these, make me feel very good.",2471.0037,1
12.817,DCA,DCA_se2_ag2_m_03_1,43,DCA_se2_ag2_m_03,55.1439,"some be the good guys and the bad guys, you kn-",57.1233,1
44.326,DCA,DCA_se2_ag2_m_03_1,151,DCA_se2_ag2_m_03,189.6307,you be playing around the girls. I-,191.3242,1
34.718,DCA,DCA_se2_ag3_m_01_1,135,DCA_se2_ag3_m_01,130.3052,"One be on the one side, and one be on the other side, and we just try to get the ball-",133.3278,1
298.87,DCA,DCA_se2_ag3_m_01_1,1334,DCA_se2_ag3_m_01,1363.3873,her hair be all tangled up.,1364.5943,1
532.113,DCA,DCA_se2_ag3_m_01_1,2200,DCA_se2_ag3_m_01,2285.458,"Why just be uh, at one place,",2287.3589,1
534.311,DCA,DCA_se2_ag3_m_01_1,2206,DCA_se2_ag3_m_01,2293.3589,Then we be able to travel everywhere we want to go.,2295.2806,1
210.144,DCA,DCA_se2_ag3_m_02_1,952,DCA_se2_ag3_m_02,1129.5943,"everybody be in the room in an uproar. You know how you [first come] to class and the teacher's not in there, you [know.]",1133.8827,1
228.231,DCA,DCA_se2_ag3_m_02_1,1043,DCA_se2_ag3_m_02,1236.6701,like he be fighting Joe [Louis- <laugh>],1238.7125,1
299.55,DCA,DCA_se2_ag3_m_02_1,1255,DCA_int_01,1506.451,Would he be out?,1507.2109,1
374.19,DCA,DCA_se2_ag3_m_02_1,1550,DCA_se2_ag3_m_02,1845.8036,"everybody be so choked up over the gifts and everything, they won't be too hungry anyway.",1849.3675,1
98.233,DCA,DCA_se2_ag3_m_03_1,325,DCA_se2_ag3_m_03,317.2851,"during the Winter, be Paul Casanova the best all around athlete.",319.736,1
325.5,DCA,DCA_se2_ag3_m_03_1,1138,DCA_int_01,1176.6035,Or would it be the same one?,1177.8321,1
232.1212,DCA,DCA_se2_ag4_f_01_1,620,DCA_se2_ag4_f_01,951.3029,birthday be set aside for holiday.,953.8151,1
118.113,DCA,DCA_se2_ag4_m_01_1,404,DCA_se2_ag4_m_01,598.7679,whether you be a-,600.0317,1
14.98,DCA,DCA_se3_ag1_f_01_1,66,DCA_se3_ag1_f_01,78.3661,The last person be it.,79.7825,1
291.39,DCA,DCA_se3_ag1_f_01_1,1133,DCA_int_03,1313.2944,How do you be kind to others?,1314.8973,1
292.714,DCA,DCA_se3_ag1_f_01_1,1142,DCA_se3_ag1_f_01,1335.35,you have to let them be first.,1337.0706,1
33411,DCA,DCA_se3_ag1_f_01_1,1342,DCA_se3_ag1_f_01,1588.2079,"Like if a person be nice to you, you should always be nice back to [them.]",1591.5361,1
6.533,DCA,DCA_se3_ag1_f_02_1,20,DCA_se3_ag1_f_02,22.4043,"we have a um, one be the mother",24.5679,1
212.714,DCA,DCA_se3_ag1_f_02_1,734,DCA_se3_ag1_f_02,810.121,they was gonna let that girl name /RD-NAME-2/ be the leader but,812.9607,1
26217,DCA,DCA_se3_ag1_f_02_1,892,DCA_se3_ag1_f_02,1007.2537,"Because they- See, when Christmas come they won't s- be surprised because they seen mostly all of it.",1012.6055,1
268.127,DCA,DCA_se3_ag1_f_02_1,904,DCA_se3_ag1_f_02,1024.7501,and we be in bed,1025.9438,1
36.724,DCA,DCA_se3_ag1_f_03_1,160,DCA_se3_ag1_f_03,175.9897,"They be saying um,",177.1181,1
72.189,DCA,DCA_se3_ag1_f_03_1,259,DCA_se3_ag1_f_03,293.1185,"And when I be doing my work, she'll say I wasn't doing it.",295.8265,1
52.429,DCA,DCA_se3_ag1_f_04_1,228,DCA_se3_ag1_f_04,217.4228,"That be when the person counted to ten real fast, say one two three four red light and turn around,",221.4046,1
238.423,DCA,DCA_se3_ag1_f_04_1,828,DCA_se3_ag1_f_04,897.0547,You be a leader not a follower.,898.6315,1
282.615,DCA,DCA_se3_ag1_f_04_1,1000,DCA_se3_ag1_f_04,1101.5558,We be running around.,1102.6658,1
367.38,DCA,DCA_se3_ag1_f_04_1,1343,DCA_int_03,1492.0883,You go be /inaudible/?,1494.2029,1
278.331,DCA,DCA_se3_ag1_m_02_1,2345,DCA_se3_ag1_m_02,2512.0238,the only way I think anybody really be recognized,2514.3894,1
177.73,DCA,DCA_se3_ag1_m_03_1,1541,DCA_int_01,1931.8217,/?/ be outside.,1932.7945,1
172.425,DCA,DCA_se3_ag1_m_05_1,647,DCA_se3_ag1_m_05,718.5563,"that's be the only time we studying and we study mostly math you know,",721.5273,1
174.3121,DCA,DCA_se3_ag1_m_06_1,909,DCA_se3_ag1_m_06,957.8969,"I don't know, sometimes it's necessa- sometime he be kind of angry.",960.6557,1
17621,DCA,DCA_se3_ag1_m_06_1,913,DCA_se3_ag1_m_06,963.1135,"He be kind of angry, you [know.]",964.2252,1
194.711,DCA,DCA_se3_ag1_m_06_1,1025,DCA_se3_ag1_m_06,1091.6884,/There be uh/ two of 'em go to school here,1093.3046,1
22.34,DCA,DCA_se3_ag2_m_02_1,251,DCA_se3_ag2_m_02,294.0668,"Jack be nimble, Jack be quick,",295.6808,1
165.75,DCA,DCA_se3_ag2_m_03_1,652,DCA_int_05,824.0011,there be anything in your life that you'd like to change?,826.3502,1
33.144,DCA,DCA_se3_ag4_m_01_2,565,DCA_se3_ag4_m_01,725.4227,"I- /cause/ I was be c- uh be careful about that. I was always careful about that, you see.",728.9724,1
72.1107,DCB,DCB_se1_ag1_f_01_1,175,DCB_se1_ag1_f_01,218.4058,"I be talking to my mother,",219.5267,1
72.349,DCB,DCB_se1_ag1_f_01_1,177,DCB_se1_ag1_f_01,219.8606,but she be getting on my nerves sometimes you know.,221.6465,1
76.728,DCB,DCB_se1_ag1_f_01_1,190,DCB_se1_ag1_f_01,236.4431,in different activities that we be having.,238.1544,1
200.144,DCB,DCB_se1_ag1_f_01_1,502,DCB_se1_ag1_f_01,616.9431,"[Yeah], sometimes they be like,",618.532,1
33816,DCB,DCB_se1_ag1_f_01_1,824,DCB_se1_ag1_f_01,1005.9686,"Yeah, it just be getting irritating.",1007.6845,1
388.413,DCB,DCB_se1_ag1_f_01_1,963,DCB_se1_ag1_f_01,1165.1801,"It's just, sometimes it be a little quiet,",1167.9872,1
388.613,DCB,DCB_se1_ag1_f_01_1,965,DCB_se1_ag1_f_01,1168.4535,"like the street be quiet, but other times, I don't know what be going on.",1171.8516,1
388.89,DCB,DCB_se1_ag1_f_01_1,967,DCB_se1_ag1_f_01,1172.635,"And then really /my mother/ be like,",1173.9872,1
388.12,DCB,DCB_se1_ag1_f_01_1,971,DCB_se1_ag1_f_01,1176.6766,"Cause I like walking, so I be walking around Kenilworth. Like, ain't nobody gonna do nothing to me.",1180.2241,1
442.46,DCB,DCB_se1_ag1_f_01_1,1123,DCB_se1_ag1_f_01,1356.6306,I'm'a be a teacher.,1357.5998,1
526.116,DCB,DCB_se1_ag1_f_01_1,1314,DCB_se1_ag1_f_01,1591.9363,"[Like, you know- Not] white people, but it be like other",1594.8553,1
526.84,DCB,DCB_se1_ag1_f_01_1,1321,DCB_se1_ag1_f_01,1601.9173,They be thinking you about to steal.,1603.2089,1
536.7,DCB,DCB_se1_ag1_f_01_1,1351,DCB_se1_ag1_f_01,1643.6981,it be like Chipotle or something.,1645.4048,1
538.212,DCB,DCB_se1_ag1_f_01_1,1364,DCB_se1_ag1_f_01,1655.8147,they be getting mad.,1656.7799,1
66310,DCB,DCB_se1_ag1_f_01_1,1663,DCB_int_01,2053.3054,"Right, it don't- be like, oh, [it's just a] dollar, but really you getting like [one bite]",2056.8213,1
674.2,DCB,DCB_se1_ag1_f_01_1,1684,DCB_se1_ag1_f_01,2080.6534,I be getting a- a Jack Daniel's sampler.,2082.7832,1
682,DCB,DCB_se1_ag1_f_01_1,1703,DCB_se1_ag1_f_01,2096.7743,And the fries! I be dipping my fries in there.,2098.8539,1
53.52,DCB,DCB_se1_ag1_f_02_1,124,DCB_se1_ag1_m_04,149.2308,and s- they also be trying to rob you s- if they see you with a fresh pair of shoes or something like that.,153.8617,1
231.323,DCB,DCB_se1_ag1_f_02_1,723,DCB_se1_ag1_m_04,965.6434,"/RD-NAME-2/, Mom and /RD-NAME-2/ be the only one who go because they got the money to",970.4136,1
268.1117,DCB,DCB_se1_ag1_f_02_1,856,DCB_se1_ag1_f_02,1138.789,and I just watched my back and see if nobody be around me.,1142.038,1
444.22,DCB,DCB_se1_ag1_f_02_1,1669,DCB_se1_ag3_m_01,2170.5631,why should somebody be a Wizards fan?,2171.966,1
450.36,DCB,DCB_se1_ag1_f_02_1,1686,DCB_se1_ag3_m_01,2198.6195,"Kevin Durant, what do you know- what- how would that be if he came here, if he actually came here?",2202.3981,1
24224,DCB,DCB_se1_ag1_f_03_1,843,DCB_se1_ag1_f_03,1125.0022,I feel like I'm'a be nervous.,1126.1609,1
32813,DCB,DCB_se1_ag1_f_03_1,1090,DCB_se1_ag1_f_03,1520.3404,[People that] be here.,1521.2573,1
334.512,DCB,DCB_se1_ag1_f_03_1,1106,DCB_se1_ag1_f_03,1538.1435,They be cooler sometimes.,1539.4952,1
422.8,DCB,DCB_se1_ag1_f_03_1,1515,DCB_se1_ag1_f_03,2051.5861,"She's like, y'all cannot be fighting,",2053.2472,1
438.1112,DCB,DCB_se1_ag1_f_03_1,1939,DCB_se1_ag1_f_03,2590.555,He be mad when I bring her up around him.,2591.8899,1
438.131,DCB,DCB_se1_ag1_f_03_1,1941,DCB_se1_ag1_f_03,2593.0529,"He be real mad, I don't care.",2594.3642,1
49314,DCB,DCB_se1_ag1_f_03_1,2088,DCB_int_01,2780.0987,You was tryna be sh- I saw you throwing [that shade right there.],2782.3397,1
5078,DCB,DCB_se1_ag1_f_03_1,2113,DCB_int_01,2809.3818,Mm. Let me not be getting in his business.,2811.6672,1
512.39,DCB,DCB_se1_ag1_f_03_1,2121,DCB_se1_ag1_f_03,2820.4606,And /RD-NAME-1/ will not be getting a ride.,2822.1932,1
172.1411,DCB,DCB_se1_ag1_m_01_1,1113,DCB_se1_ag1_m_01,1094.28,"They be like,",1094.7082,1
178.535,DCB,DCB_se1_ag1_m_01_1,1165,DCB_se1_ag1_m_01,1137.3448,like I be from a neighborhood,1138.5774,1
180.336,DCB,DCB_se1_ag1_m_01_1,1175,DCB_se1_ag1_m_01,1141.8066,"I be like,",1142.24,1
344.616,DCB,DCB_se1_ag1_m_01_1,2212,DCB_se1_ag1_m_01,2193.8031,"So they be like,",2194.7004,1
344.121,DCB,DCB_se1_ag1_m_01_1,2218,DCB_se1_ag1_m_01,2200.5256,"it be like, if it's a group of black kids walking dow- like I'll give example, if a group of black kids walking down Eighth Street",2205.8557,1
376.152,DCB,DCB_se1_ag1_m_01_1,2411,DCB_se1_ag1_m_01,2391.9646,"if I be like, see you sing",2393.2659,1
114.443,DCB,DCB_se1_ag1_m_02_1,1153,DCB_se1_ag1_m_02,1397.8418,And I probably just be sitting out there with him or sitting in the car,1401.7587,1
128.1319,DCB,DCB_se1_ag1_m_02_1,1380,DCB_se1_ag1_m_02,1679.62,"Or we be like making skate videos like, um, editing our skate videos- the- the videos that we record throughout the day,",1685.8671,1
128.87,DCB,DCB_se1_ag1_m_02_1,1454,DCB_se1_ag1_m_02,1779.1871,to do besides be outside and skateboard by myself or with one of my other friends,1783.9515,1
146.264,DCB,DCB_se1_ag1_m_02_1,2147,DCB_se1_ag1_m_02,2571.7779,"to just be in the streets,",2573.1336,1
146.44,DCB,DCB_se1_ag1_m_02_1,2165,DCB_se1_ag1_m_02,2587.3581,They could just be walking around r-,2589.0559,1
12.1149,DCB,DCB_se1_ag1_m_03_1,82,DCB_se1_ag1_m_03,71.9442,"he be around like,",72.625,1
12.1713,DCB,DCB_se1_ag1_m_03_1,88,DCB_se1_ag1_m_03,75.2631,"Like where my brother be at, like,",76.6293,1
167.19,DCB,DCB_se1_ag1_m_03_1,737,DCB_se1_ag1_m_03,746.4331,"And then that's how I be like,",747.1931,1
281.101,DCB,DCB_se1_ag1_m_03_1,1073,DCB_se1_ag1_m_03,1087.7281,"do stuff that I know I'm'a get in trouble for. Now I be like- And I- I just- I- I just think back- I'm like,",1091.4386,1
307.86,DCB,DCB_se1_ag1_m_03_1,1414,DCB_se1_ag1_m_03,1361.5199,We be laughing together.,1362.4338,1
